{
  "schema_version": "1.1",
  "meta": {
    "title": "スキル横断レビュー指摘の是正（workflow 経由）",
    "locale": "ja-JP"
  },
  "epic": {
    "title": "【agent-create-supporter】スキルレビュー指摘の是正",
    "notes_markdown": "## 背景\n\nスキル横断レビューで、文書陳腐化・ゲート迂回・レガシー複製・スキーマ非対称が指摘された。\n\n## 方針\n\n- workflow v2（intake→…→execute）に沿い、文書とスクリプトを整合\n- `plan-reviewer` 必須を `handoff_to_asana.py` でオプション強制可能に\n- レガシー `skills/agent-creater/agents/asana-buddy/` を削除\n\n## 完了定義\n\n棚卸し・各 SKILL/README・orchestrator persona が v2 と一致し、レガシーパスがリポジトリから無くなること。"
  },
  "subtasks": [
    {
      "title": "【1/6・整備】skills-inventory を v2 現状に更新",
      "pillar": "整備",
      "background": "棚卸しがエピック前のギャップ表のまま残り、単一参照として使えない。",
      "summary": "docs/inventory/skills-inventory.md を workflow v2・intake/gate・解消済みギャップに合わせて書き換える。Handoff 例に skill-review 用を追加。",
      "done_when": "ギャップ（未解消）表がなくなり、orchestrator の二役と全 slug が正しく記載されている。"
    },
    {
      "title": "【2/6・整備】workflow-orchestrator 文書・persona 整合",
      "pillar": "整備",
      "background": "README が passed のみ必須と誤記。SKILL から未登録 slug 案内が欠落。persona が gate のみ。",
      "summary": "README（passed_with_notes 可）、SKILL（未登録 slug）、personas（intake 例）を更新。",
      "done_when": "3 ファイルが v2 とレビュー指摘に一致している。"
    },
    {
      "title": "【3/6・整備】issue-story-planner README 追加",
      "pillar": "整備",
      "background": "agent-creater 契約で README 必須だが planner に無い。",
      "summary": "skills/issue-story-planner/README.md を追加。SKILL のパイプライン・Handoff 例へのリンクを載せる。",
      "done_when": "README が存在し SKILL からリンクされている。"
    },
    {
      "title": "【4/6・実装】PlanReviewResult JSON Schema と投入ゲート",
      "pillar": "実装",
      "background": "Handoff のみ機械検証があり、review 必須が CLI で迂回できる。",
      "summary": "plan-reviewer/schemas に PlanReviewResult v1.0 schema を追加。handoff_to_asana.py に --require-review-result を追加し status を検証。",
      "done_when": "スキーマファイルがあり、未レビュー Handoff で --require-review-result 時にエラーになる。"
    },
    {
      "title": "【5/6・整備】asana-buddy README と e2e 検証記録",
      "pillar": "整備",
      "background": "asana-buddy README が旧フロー（planner 直）のまま。e2e-dryrun が v2 未反映。",
      "summary": "asana-buddy README に標準パイプラインと --require-review-result を追記。docs/verification/e2e-dryrun.md に intake 追記。",
      "done_when": "README と e2e-dryrun が workflow v2 と一致。"
    },
    {
      "title": "【6/6・実装】レガシー agents/asana-buddy 削除",
      "pillar": "実装",
      "background": "skills/agent-creater/agents/asana-buddy/ にスクリプト複製が残存。",
      "summary": "レガシーディレクトリを削除。agent_handler の legacy .env パス参照を除去。inventory のレガシー節を削除済みに更新。",
      "done_when": "レガシーパスが git 上に存在せず、SKILL の説明が新パスのみを指す。"
    }
  ]
}
