{
  "schema_version": "1.1",
  "meta": {
    "title": "Example: internal docs refresh",
    "locale": "ja-JP"
  },
  "epic": {
    "title": "【例】社内ドキュメント整備 — 課題整理と実行計画",
    "notes_markdown": "■ 課題点の整理\n- 情報が散在しオンボーディングに時間がかかる。\n\n■ 解決ストーリー\n1) 棚卸し 2) 優先度付け 3) 単一の入口ページへ集約。\n\n■ 進め方\n週次で進捗を確認し、完了定義は「新メンバーが自力で最初の PR まで辿り着ける」こと。"
  },
  "subtasks": [
    {
      "title": "【入口】対象リポジトリと読者ペルソナの定義",
      "pillar": "スコープ",
      "background": "ドキュメント整備の対象範囲と読者像が曖昧なままだと、後続の棚卸しや章立てがブレる。",
      "summary": "対象リポジトリ（または製品）と、主な読者ペルソナ（新卒／中途／外注など）を一文ずつで固定する。",
      "done_when": "対象と読者が文書化され、関係者が異議なく参照できる状態になっている。"
    },
    {
      "title": "【棚卸し】既存ドキュメントの一覧と重複マーク",
      "pillar": "整理",
      "background": "どこに何があるか分からず、重複や陳腐化したページが残っている。",
      "summary": "既存ドキュメントを URL またはパスで一覧化し、重複・deprecated 相当をマークする。",
      "done_when": "一覧表が完成し、各エントリに状態（現役／重複／deprecated）が付いている。"
    },
    {
      "title": "【集約】README / CONTRIBUTING の章立て案を確定",
      "pillar": "設計",
      "background": "情報を散在させたままではオンボーディングが改善しない。",
      "summary": "README と CONTRIBUTING の最小章立て案を出し、どのトピックをどちらに載せるか決める。",
      "done_when": "章立て案が合意され、次の執筆・移行にそのまま使える。"
    }
  ]
}
